{
  "$schema": "https://json-schema.org/draft/2020-12/schema",
  "$id": "https://weave.test/contracts/portability/migration-run.schema.json",
  "title": "MigrationRun",
  "type": "object",
  "additionalProperties": false,
  "required": [
    "runId",
    "domainKey",
    "state",
    "dryRunReportRef",
    "providerMappingRef",
    "objectCounts",
    "contentHashes",
    "auditRefs",
    "applyAllowed",
    "redaction"
  ],
  "properties": {
    "runId": {"type": "string"},
    "domainKey": {"type": "string"},
    "state": {
      "type": "string",
      "enum": [
        "discovered",
        "preflight_failed",
        "preflight_passed",
        "exported",
        "dry_run_completed",
        "blocked",
        "approved",
        "applying",
        "applied",
        "verified",
        "rolled_back",
        "archived"
      ]
    },
    "dryRunReportRef": {"type": "string"},
    "providerMappingRef": {"type": "string"},
    "objectCounts": {"type": "object", "minProperties": 1, "additionalProperties": {"type": "integer", "minimum": 0}},
    "contentHashes": {"type": "array", "minItems": 1, "items": {"type": "string", "pattern": "^sha256:[a-f0-9]{64}$"}},
    "auditRefs": {"type": "array", "minItems": 1, "items": {"type": "string"}},
    "applyAllowed": {"type": "boolean"},
    "redaction": {"type": "string", "enum": ["support_safe"]}
  }
}
